title,url
Illustration Work for Children's Books,https://docsend.com/v/ftp56/illustrationdesigns
Custom Brand Identity Design Projects,https://docsend.com/v/ftp56/brandidentity
Professional Logo Design Portfolio,https://docsend.com/v/ftp56/logofolio
Creative Book Cover and Layout Design,https://docsend.com/v/ftp56/bookdesign
Comprehensive Branding Campaigns,https://docsend.com/v/ftp56/branding
Social Media Graphics and Creatives,https://docsend.com/v/ftp56/socialmedia
UI/UX Design Case Studies and Projects,https://docsend.com/v/ftp56/uiux
Product Packaging Design Examples,https://docsend.com/v/ftp56/packagingdesign
YouTube Thumbnail Designs Portfolio,https://docsend.com/v/ftp56/thumbnaildesign
Complete Professional Design Portfolio,https://docsend.com/v/ftp56/portfolio